{
  "id": "IFs",
  "featureType": "IndoorFeatures",
  "layers": [
    {
      "id": "TL-1",
      "featureType": "ThematicLayer",
      "semanticExtension": false,
      "theme": "Physical",
      "primalSpace": {
        "id": "PS-1",
        "featureType": "PrimalSpaceLayer",
        "creationDatetime": "2025-10-30T13:00:00",
        "cellSpaceMember": [
          {
            "id": "R1",
            "featureType": "CellSpace",
            "duality": "N1",
            "poi": false,
            "level": "1",
            "cellSpaceGeom": {
              "geometry2D": {
                "type": "Polygon",
                "coordinates": [[[0,0], [3,0], [3,3], [0,3], [0,0]]]
              }
            },
            "boundedBy": ["B1"]
          },
          {
            "id": "R2",
            "featureType": "CellSpace",
            "duality": "N2",
            "poi": false,
            "level": "1",
            "cellSpaceGeom": {
              "geometry2D": {
                "type": "Polygon",
                "coordinates": [[[4,0], [7,0], [7,7], [4,7], [4,0]]]
              }
            },
            "boundedBy": ["B2"]
          },
          {
            "id": "D1",
            "featureType": "CellSpace",
            "duality": "N3",
            "poi": false,
            "level": "1",
            "cellSpaceGeom": {
              "geometry2D": {
                "type": "Polygon",
                "coordinates": [[[3,1], [4,1], [4,2], [3,2], [3,1]]]
              }
            },
            "boundedBy": ["B1", "B2"]
          }
        ],
        "cellBoundaryMember": [
          {
            "id": "B1",
            "featureType": "CellBoundary",
            "isVirtual": false,
            "duality": "E1",
            "cellBoundaryGeom": {
              "geometry2D": {
                "type": "LineString",
                "coordinates": [[3,1],[3,2]]
              }
            }
          },
          {
            "id": "B2",
            "featureType": "CellBoundary",
            "isVirtual": false,
            "duality": "E2",
            "cellBoundaryGeom": {
              "geometry2D": {
                "type": "LineString",
                "coordinates": [[4,1],[4,2]]
              }
            }
          }
        ]
      },
      "dualSpace": {
        "id": "DS-1",
        "featureType": "DualSpaceLayer",
        "creationDatetime": "2025-10-30T13:00:00",
        "isLogical": false,
        "isDirected": false,
        "nodeMember": [
          {
            "id": "N1",
            "featureType": "Node",
            "duality": "R1",
            "geometry": {
              "type": "Point",
              "coordinates": [1.5,1.5]
            },
            "connects": ["E1"]
          },
          {
            "id": "N2",
            "featureType": "Node",
            "duality": "R2",
            "geometry": {
              "type": "Point",
              "coordinates": [5.5,1.5]
            },
            "connects": ["E2"]
          },
          {
            "id": "N3",
            "featureType": "Node",
            "duality": "D1",
            "geometry": {
              "type": "Point",
              "coordinates": [3.5,1.5]
            },
            "connects": ["E1", "E2"]
          }
        ],
        "edgeMember": [
          {
            "id": "E1",
            "featureType": "Edge",
            "duality": "B1",
            "weight": 1.0,
            "geometry": {
              "type": "LineString",
              "coordinates": [[1.5,1.5],[3.5,1.5]]
            },
            "connects": ["N1", "N2"]
          },
          {
            "id": "E2",
            "featureType": "Edge",
            "duality": "B2",
            "weight": 1.0,
            "geometry": {
              "type": "LineString",
              "coordinates": [[3.5,1.5],[5.5,1.5]]
            },
            "connects": ["N2", "N3"]
          }
        ]
      }
    },
    {
      "id": "TL-2",
      "featureType": "ThematicLayer",
      "semanticExtension": false,
      "theme": "Physical",
      "primalSpace": {
        "id": "PS-2",
        "featureType": "PrimalSpaceLayer",
        "creationDatetime": "2025-10-30T13:00:00",
        "cellSpaceMember": [
          {
            "id": "P1",
            "featureType": "CellSpace",
            "duality": "PN1",
            "poi": true,
            "level": "1",
            "cellSpaceGeom": {
              "geometry2D": {
                "type": "Polygon",
                "coordinates": [[[0,0], [1,0], [1,1], [0,1], [0,0]]]
              }
            }
          }
        ]
      },
      "dualSpace": {
        "id": "DS-2",
        "featureType": "DualSpaceLayer",
        "creationDatetime": "2025-10-30T13:00:00",
        "isLogical": false,
        "isDirected": false,
        "nodeMember": [
          {
            "id": "PN1",
            "featureType": "Node",
            "duality": "P1",
            "geometry": {
              "type": "Point",
              "coordinates": [0.5,0.5]
            }
          }
        ]
      }
    }
  ],
  "layerConnections": [
    {
      "id": "ILC-1",
      "featureType": "InterLayerConnection",
      "connectedLayers": ["TL-1", "TL-2"],
      "connectedNodes": ["N1", "PN1"],
      "connectedCells": ["R1", "P1"],
      "typeOfTopoExpression": "CONTAINS"
    }
  ]
}